{
  "schema_version": "0.1.0",
  "request_id": "pr_20260410_fxt001",
  "created_at": "2026-04-10T18:30:00Z",
  "artifact_type": "concept_packet_draft",
  "source_draft_ref": {
    "path": "generated/drafts/example-game/concept_packet.draft.json",
    "hash": "sha256:aaaaaaaaaaaaaaaaaaaaaaaaaaaaaaaaaaaaaaaaaaaaaaaaaaaaaaaaaaaaaaaa"
  },
  "source_manifest_ref": {
    "path": "generated/drafts/example-game/concept_packet.manifest.json",
    "hash": "sha256:bbbbbbbbbbbbbbbbbbbbbbbbbbbbbbbbbbbbbbbbbbbbbbbbbbbbbbbbbbbbbbbb"
  },
  "target_path": "generated/review/example-game/",
  "promoter_version": "draft-promoter-stub-v0.1.0",
  "mode": "review",
  "status": "pending"
}
